{
  "entries": [
    {
      "kind": "npm_package",
      "license": "Apache-2.0",
      "name": "gltf_validator",
      "path": "G:\\DevWork\\GameDev\\BlenderAssetFactory\\.worktrees\\codex-release-pipeline\\.tooling\\release-node\\node_modules\\gltf-validator\\package.json",
      "sha256": "3578d16153fa237c72784588da2e8fcccc9cd3c1c58ef34c7912f0732d2f5fa6",
      "size": 618,
      "source": "https://www.npmjs.com/package/gltf-validator/v/2.0.0-dev.3.10",
      "version": "2.0.0-dev.3.10"
    },
    {
      "kind": "npm_package",
      "license": "Apache-2.0",
      "name": "playwright_core",
      "path": "G:\\DevWork\\GameDev\\BlenderAssetFactory\\.worktrees\\codex-release-pipeline\\.tooling\\release-node\\node_modules\\playwright-core\\package.json",
      "sha256": "759e376f995bf39edd4810d699b99469bab1d7428b6fbc78d41912f367df7ba9",
      "size": 876,
      "source": "https://www.npmjs.com/package/playwright-core/v/1.61.1",
      "version": "1.61.1"
    },
    {
      "kind": "npm_package",
      "license": "MIT",
      "name": "three",
      "path": "G:\\DevWork\\GameDev\\BlenderAssetFactory\\.worktrees\\codex-release-pipeline\\.tooling\\release-node\\node_modules\\three\\package.json",
      "sha256": "1d5c438acdc1fe5a52fb8ede2e417afd91fec91d22275c40f7b739591b24e4df",
      "size": 3826,
      "source": "https://www.npmjs.com/package/three/v/0.185.1",
      "version": "0.185.1"
    },
    {
      "kind": "release_runtime",
      "license": "MIT",
      "name": "gltfpack",
      "path": "G:\\DevWork\\GameDev\\BlenderAssetFactory\\.worktrees\\codex-release-pipeline\\.tooling\\gltfpack\\gltfpack.exe",
      "sha256": "ff64f45e84aac9a1f58880e40934b3f29277413e2d0b3ed257322261ec021d2b",
      "size": 2966528,
      "source": "https://github.com/zeux/meshoptimizer/releases/download/v1.2/gltfpack-windows.zip",
      "version": "1.2"
    },
    {
      "kind": "release_runtime",
      "license": "MIT",
      "name": "node",
      "path": "G:\\DevWork\\GameDev\\BlenderAssetFactory\\.worktrees\\codex-release-pipeline\\.tooling\\node\\node-v24.17.0-win-x64\\node.exe",
      "sha256": "c6335d08331c23d68b9f2b18adb102002d76ef150b47248e954c507e0d033664",
      "size": 92299080,
      "source": "https://nodejs.org/dist/v24.17.0/node-v24.17.0-win-x64.zip",
      "version": "v24.17.0"
    },
    {
      "kind": "runtime",
      "license": null,
      "name": "python",
      "path": "G:\\DevWork\\GameDev\\BlenderAssetFactory\\.worktrees\\codex-release-pipeline\\.tooling\\python\\cpython-3.12.11-windows-x86_64-none\\python.exe",
      "sha256": "a8d0979b74f577fa32fe6d697febea20149b2c500f66502a1eda8d91c119f835",
      "size": 91648,
      "source": null,
      "version": "Python 3.12.11"
    },
    {
      "kind": "runtime",
      "license": null,
      "name": "uv",
      "path": "G:\\DevWork\\GameDev\\BlenderAssetFactory\\.worktrees\\codex-release-pipeline\\.tooling\\uv\\uv.exe",
      "sha256": "6d40479cd1d0d5db7fc0fe68ad703fc8acbd84bba50d864bb97461f6af9d9561",
      "size": 76024832,
      "source": null,
      "version": "uv 0.11.29 (901092ee1 2026-07-15 x86_64-pc-windows-msvc)"
    }
  ],
  "model_root": "G:\\LLMs",
  "root": "G:\\DevWork\\GameDev\\BlenderAssetFactory\\.worktrees\\codex-release-pipeline",
  "schema_version": 1
}
